{
  "server": {
    "port": 5100,
    "basePath": "/mcp",
    "bindAddress": "localhost"
  },
  "defaults": {
    "agent": {
      "provider": "github-copilot",
      "model": "claude-sonnet-4",
      "reasoningEffort": "medium"
    },
    "session": {
      "mode": "per-connection",
      "poolTimeoutMinutes": 30,
      "responseTimeoutMinutes": 10,
      "responseTimeoutSeconds": 600
    },
    "signaling": {
      "keepaliveIntervalSeconds": 15
    }
  },
  "tools": {
    "review_code": {
      "description": "Request an AI code review for the specified changes",
      "parameters": {
        "branch": {
          "type": "string",
          "description": "Branch to review against base",
          "required": false
        },
        "focusAreas": {
          "type": "array",
          "items": { "type": "string" },
          "description": "Specific areas to focus the review on",
          "required": false
        }
      },
      "fixedParameters": {
        "reviewType": "code"
      },
      "agent": {
        "promptFile": "./prompts/code-review.md",
        "tools": ["filesystem", "git"],
        "model": "claude-sonnet-4",
        "reasoningEffort": "high"
      },
      "session": {
        "mode": "per-reference",
        "referenceIdParameter": "branch"
      },
      "signaling": {
        "keepaliveIntervalSeconds": 15,
        "tools": [
          {
            "name": "respond",
            "description": "Send a response back to the caller during execution.",
            "parameters": {
              "message": {
                "type": "string",
                "description": "The message to send back to the caller.",
                "required": true
              }
            },
            "isBlocking": false
          }
        ]
      }
    },
    "analyze_architecture": {
      "description": "Analyze codebase architecture and provide recommendations",
      "parameters": {
        "scope": {
          "type": "string",
          "description": "Directory or namespace to analyze",
          "required": true
        }
      },
      "agent": {
        "promptFile": "./prompts/architecture-analysis.md",
        "tools": ["filesystem", "code-search"],
        "reasoningEffort": "high"
      },
      "signaling": {
        "keepaliveIntervalSeconds": 15,
        "tools": [
          {
            "name": "respond",
            "description": "Send interim progress updates to the caller.",
            "parameters": {
              "message": {
                "type": "string",
                "description": "The message to send back to the caller.",
                "required": true
              }
            },
            "isBlocking": false
          },
          {
            "name": "request_input",
            "description": "Ask the caller a clarifying question and wait for the answer.",
            "parameters": {
              "question": {
                "type": "string",
                "description": "The question to ask the caller.",
                "required": true
              },
              "options": {
                "type": "array",
                "description": "Optional list of choices to offer the caller.",
                "items": { "type": "string" }
              }
            },
            "isBlocking": true,
            "responseFormat": "json",
            "responseParameters": {
              "answer": {
                "type": "string",
                "description": "The caller's answer.",
                "required": true
              }
            }
          }
        ]
      }
    }
  },
  "agentToolSources": {
    "filesystem": {
      "type": "stdio",
      "command": "npx",
      "args": ["-y", "@anthropic/mcp-filesystem", "/workspace"]
    },
    "git": {
      "type": "stdio",
      "command": "npx",
      "args": ["-y", "@anthropic/mcp-git"]
    },
    "code-search": {
      "type": "http",
      "url": "http://localhost:5200/mcp",
      "headers": {
        "Authorization": "Bearer {{ENV:CODE_SEARCH_TOKEN}}"
      }
    }
  }
}
